{"capabilityDigest":"083e9c4fe92b703df28ba15369aad99ee6bcecdc","compositionCount":7,"kind":"hyperframes-released-rate-matrix","passed":true,"probeFrames":4,"probes":[{"decoded":true,"duration":{"denominator":"48","numerator":"7"},"kind":"chart-story","mediaSha256":"a41e9132270316003f5446e0a4c2f11e3f07aa69af206141725b40657b9b5938","rate":"24","stream":{"avg_frame_rate":"24/1","codec_name":"prores","height":1080,"nb_read_frames":"4","pix_fmt":"yuva444p12le","r_frame_rate":"24/1","width":1920}},{"decoded":true,"duration":{"denominator":"48000","numerator":"7007"},"kind":"chart-story","mediaSha256":"7784f0692957f21cc65d9edb4eaa0efe5d9be2a53ce316d0d42e0295914913ed","rate":"24000/1001","stream":{"avg_frame_rate":"24000/1001","codec_name":"prores","height":1080,"nb_read_frames":"4","pix_fmt":"yuva444p12le","r_frame_rate":"24000/1001","width":1920}},{"decoded":true,"duration":{"denominator":"50","numerator":"7"},"kind":"chart-story","mediaSha256":"7f41324ab528525ef5913ef7e44844c6fb728b85e68484c6144f7a1ee4e9fc35","rate":"25","stream":{"avg_frame_rate":"25/1","codec_name":"prores","height":1080,"nb_read_frames":"4","pix_fmt":"yuva444p12le","r_frame_rate":"25/1","width":1920}},{"decoded":true,"duration":{"denominator":"60","numerator":"7"},"kind":"chart-story","mediaSha256":"96e25da4548df23d962daf8532bfc092257d234741130493846b6f7b9fe20762","rate":"30","stream":{"avg_frame_rate":"30/1","codec_name":"prores","height":1080,"nb_read_frames":"4","pix_fmt":"yuva444p12le","r_frame_rate":"30/1","width":1920}},{"decoded":true,"duration":{"denominator":"60000","numerator":"7007"},"kind":"chart-story","mediaSha256":"5c4642c766b37e17df4906765568e1a6a06d80cb19c07fdb86cc4be85b07b091","rate":"30000/1001","stream":{"avg_frame_rate":"30000/1001","codec_name":"prores","height":1080,"nb_read_frames":"4","pix_fmt":"yuva444p12le","r_frame_rate":"30000/1001","width":1920}},{"decoded":true,"duration":{"denominator":"100","numerator":"7"},"kind":"chart-story","mediaSha256":"61c87be22ad3c81ae3d3e60c7f39a45b9b3d3e9f0bbb23a624a087bf94e3d1c0","rate":"50","stream":{"avg_frame_rate":"50/1","codec_name":"prores","height":1080,"nb_read_frames":"4","pix_fmt":"yuva444p12le","r_frame_rate":"50/1","width":1920}},{"decoded":true,"duration":{"denominator":"120","numerator":"7"},"kind":"chart-story","mediaSha256":"c5a6e06d2558bb270e143168b3f68862ed8d41a16f08f95aa41a9e7868cf4461","rate":"60","stream":{"avg_frame_rate":"60/1","codec_name":"prores","height":1080,"nb_read_frames":"4","pix_fmt":"yuva444p12le","r_frame_rate":"60/1","width":1920}},{"decoded":true,"duration":{"denominator":"120000","numerator":"7007"},"kind":"chart-story","mediaSha256":"4fd4ca86547fe170266c8408bfaf176d8a0d36f09a6d3f3b37d50491d9b97857","rate":"60000/1001","stream":{"avg_frame_rate":"60000/1001","codec_name":"prores","height":1080,"nb_read_frames":"4","pix_fmt":"yuva444p12le","r_frame_rate":"60000/1001","width":1920}},{"decoded":true,"duration":{"denominator":"48","numerator":"7"},"kind":"count-up","mediaSha256":"e81797c0e4f3c081ee41cd2a1442c0cbd65eb1220e2b06740cf32ab9ed718ddc","rate":"24","stream":{"avg_frame_rate":"24/1","codec_name":"prores","height":1920,"nb_read_frames":"4","pix_fmt":"yuva444p12le","r_frame_rate":"24/1","width":1080}},{"decoded":true,"duration":{"denominator":"48000","numerator":"7007"},"kind":"count-up","mediaSha256":"1c0fab16b1c4d30afe1ba2e8427a121a5043d5ee879d24aad03d7afa791bc702","rate":"24000/1001","stream":{"avg_frame_rate":"24000/1001","codec_name":"prores","height":1920,"nb_read_frames":"4","pix_fmt":"yuva444p12le","r_frame_rate":"24000/1001","width":1080}},{"decoded":true,"duration":{"denominator":"50","numerator":"7"},"kind":"count-up","mediaSha256":"3a4bf6c8f9b6f1f3f96b348708440915427825355f8698080126f726bf668870","rate":"25","stream":{"avg_frame_rate":"25/1","codec_name":"prores","height":1920,"nb_read_frames":"4","pix_fmt":"yuva444p12le","r_frame_rate":"25/1","width":1080}},{"decoded":true,"duration":{"denominator":"60","numerator":"7"},"kind":"count-up","mediaSha256":"249a7236af1bbbc8d200c78fca5ee3157b39c8a99b26f4b69f8e44b0b0a5f368","rate":"30","stream":{"avg_frame_rate":"30/1","codec_name":"prores","height":1920,"nb_read_frames":"4","pix_fmt":"yuva444p12le","r_frame_rate":"30/1","width":1080}},{"decoded":true,"duration":{"denominator":"60000","numerator":"7007"},"kind":"count-up","mediaSha256":"cfd1414dfd42dfa9f2f748533160507be57467db5bfbfbf7036af9d4f1b70d97","rate":"30000/1001","stream":{"avg_frame_rate":"30000/1001","codec_name":"prores","height":1920,"nb_read_frames":"4","pix_fmt":"yuva444p12le","r_frame_rate":"30000/1001","width":1080}},{"decoded":true,"duration":{"denominator":"100","numerator":"7"},"kind":"count-up","mediaSha256":"b7b477a8569fb69a8dda23395a27786db4f016edd0f200462429035b2e462254","rate":"50","stream":{"avg_frame_rate":"50/1","codec_name":"prores","height":1920,"nb_read_frames":"4","pix_fmt":"yuva444p12le","r_frame_rate":"50/1","width":1080}},{"decoded":true,"duration":{"denominator":"120","numerator":"7"},"kind":"count-up","mediaSha256":"27dc0d852ec098958f87a9291b50830c2eb1ce92dd1d64b873a376d3af46ad09","rate":"60","stream":{"avg_frame_rate":"60/1","codec_name":"prores","height":1920,"nb_read_frames":"4","pix_fmt":"yuva444p12le","r_frame_rate":"60/1","width":1080}},{"decoded":true,"duration":{"denominator":"120000","numerator":"7007"},"kind":"count-up","mediaSha256":"ab6f500222d25e7591b816b2c8207a083b18535a8070cf6ce645c6eac300a6c0","rate":"60000/1001","stream":{"avg_frame_rate":"60000/1001","codec_name":"prores","height":1920,"nb_read_frames":"4","pix_fmt":"yuva444p12le","r_frame_rate":"60000/1001","width":1080}},{"decoded":true,"duration":{"denominator":"48","numerator":"7"},"kind":"hw-callout-circle","mediaSha256":"1214e139107c7de12da800b9765df364d76d85c7e0076b4aff632384e282a284","rate":"24","stream":{"avg_frame_rate":"24/1","codec_name":"prores","height":1920,"nb_read_frames":"4","pix_fmt":"yuva444p12le","r_frame_rate":"24/1","width":1080}},{"decoded":true,"duration":{"denominator":"48000","numerator":"7007"},"kind":"hw-callout-circle","mediaSha256":"32e0a6b67139e8a5b7f2d1f0facdc1cbde8d6f7acac0ee28c4a0eb9196970305","rate":"24000/1001","stream":{"avg_frame_rate":"24000/1001","codec_name":"prores","height":1920,"nb_read_frames":"4","pix_fmt":"yuva444p12le","r_frame_rate":"24000/1001","width":1080}},{"decoded":true,"duration":{"denominator":"50","numerator":"7"},"kind":"hw-callout-circle","mediaSha256":"6f71841698e9bc015bdd7ba1467fac4a43358933a257a2717fd572d66e21b1a5","rate":"25","stream":{"avg_frame_rate":"25/1","codec_name":"prores","height":1920,"nb_read_frames":"4","pix_fmt":"yuva444p12le","r_frame_rate":"25/1","width":1080}},{"decoded":true,"duration":{"denominator":"60","numerator":"7"},"kind":"hw-callout-circle","mediaSha256":"2c57039145bd637a88bc3deb2fd8f44ee840598b43942b476509b660ab41fa25","rate":"30","stream":{"avg_frame_rate":"30/1","codec_name":"prores","height":1920,"nb_read_frames":"4","pix_fmt":"yuva444p12le","r_frame_rate":"30/1","width":1080}},{"decoded":true,"duration":{"denominator":"60000","numerator":"7007"},"kind":"hw-callout-circle","mediaSha256":"f2eae6f7719c9e18926b84144c7e09cc524f39f31b9d2bbee30eb666f92a1c27","rate":"30000/1001","stream":{"avg_frame_rate":"30000/1001","codec_name":"prores","height":1920,"nb_read_frames":"4","pix_fmt":"yuva444p12le","r_frame_rate":"30000/1001","width":1080}},{"decoded":true,"duration":{"denominator":"100","numerator":"7"},"kind":"hw-callout-circle","mediaSha256":"fbf2142c0e76ad5dc8236f9776a84fa220a5ad81db081f3c4ba29c157623685a","rate":"50","stream":{"avg_frame_rate":"50/1","codec_name":"prores","height":1920,"nb_read_frames":"4","pix_fmt":"yuva444p12le","r_frame_rate":"50/1","width":1080}},{"decoded":true,"duration":{"denominator":"120","numerator":"7"},"kind":"hw-callout-circle","mediaSha256":"c92eb7d56ce313fec7564cd00de926b0a33799f43626784fdd2ec9b1bad62e82","rate":"60","stream":{"avg_frame_rate":"60/1","codec_name":"prores","height":1920,"nb_read_frames":"4","pix_fmt":"yuva444p12le","r_frame_rate":"60/1","width":1080}},{"decoded":true,"duration":{"denominator":"120000","numerator":"7007"},"kind":"hw-callout-circle","mediaSha256":"5cc24a362d25b616041c6dd89013bfa15f68efc80e050b05824826ca8fd08ebb","rate":"60000/1001","stream":{"avg_frame_rate":"60000/1001","codec_name":"prores","height":1920,"nb_read_frames":"4","pix_fmt":"yuva444p12le","r_frame_rate":"60000/1001","width":1080}},{"decoded":true,"duration":{"denominator":"48","numerator":"7"},"kind":"hw-scribble-transition","mediaSha256":"89fedd3d2322e6f041475e4bc02d8d75c46081687260d69141fe64979e6c8b80","rate":"24","stream":{"avg_frame_rate":"24/1","codec_name":"prores","height":1920,"nb_read_frames":"4","pix_fmt":"yuva444p12le","r_frame_rate":"24/1","width":1080}},{"decoded":true,"duration":{"denominator":"48000","numerator":"7007"},"kind":"hw-scribble-transition","mediaSha256":"4a28c02fd881a1d5fc85d88eea7ece71f48fc70f37e3a5ca63415ba472f19e99","rate":"24000/1001","stream":{"avg_frame_rate":"24000/1001","codec_name":"prores","height":1920,"nb_read_frames":"4","pix_fmt":"yuva444p12le","r_frame_rate":"24000/1001","width":1080}},{"decoded":true,"duration":{"denominator":"50","numerator":"7"},"kind":"hw-scribble-transition","mediaSha256":"2ba2f18b1be37d6feafc69bda00eb2d94f81725b303cced8a963e4bd9b472930","rate":"25","stream":{"avg_frame_rate":"25/1","codec_name":"prores","height":1920,"nb_read_frames":"4","pix_fmt":"yuva444p12le","r_frame_rate":"25/1","width":1080}},{"decoded":true,"duration":{"denominator":"60","numerator":"7"},"kind":"hw-scribble-transition","mediaSha256":"3328fb75e9320d93776561036259d7eaa6e0a4e181b6777201ef334ade78ee98","rate":"30","stream":{"avg_frame_rate":"30/1","codec_name":"prores","height":1920,"nb_read_frames":"4","pix_fmt":"yuva444p12le","r_frame_rate":"30/1","width":1080}},{"decoded":true,"duration":{"denominator":"60000","numerator":"7007"},"kind":"hw-scribble-transition","mediaSha256":"a6396a2828f1cab4d5c5f8e9a19a20e7b32280b46743fb436a853a48ed9ec07a","rate":"30000/1001","stream":{"avg_frame_rate"